{
    "width": 15,
    "height": 10,
    "tile_size": {"x": 100, "y": 100},
    "user_demand": 1e6,
    "density": [
        [0, 0, 0, 2,  0, 0, 0, 0, 0, 0, 0, 0, 0, 0, 0],
        [0, 0, 0, 0,  0, 0, 0, 0, 0, 0, 0, 0, 0, 1, 0],
        [0, 0, 0, 0,  8, 0, 0, 3, 0, 0, 0, 0, 0, 0, 0],
        [0, 0, 0, 4, 13, 5, 0, 0, 0, 0, 0, 0, 0, 0, 0],
        [0, 0, 0, 3,  6, 0, 0, 0, 0, 0, 0, 0, 0, 0, 0],
        [0, 0, 1, 0,  0, 0, 0, 0, 0, 0, 0, 0, 0, 0, 0],
        [0, 0, 0, 0,  0, 0, 0, 0, 0, 0, 0, 0, 0, 0, 0],
        [0, 0, 0, 0,  0, 0, 0, 0, 0, 0, 4, 0, 0, 0, 0],
        [0, 0, 1, 0,  0, 0, 0, 0, 0, 3, 0, 6, 0, 0, 0],
        [0, 0, 0, 0,  1, 0, 0, 0, 0, 0, 0, 1, 0, 0, 0]
    ],
    "pylons": [
        {"pos": {"x": 1000, "y": 800, "h": 30}},
        {"pos": {"x": 400, "y": 800, "h": 30}},
        {"pos": {"x": 100, "y": 200, "h": 30}},
        {"pos": {"x": 400, "y": 400, "h": 30}},
        {"pos": {"x": 1000, "y": 100,"h": 30}}
    ]
}
